{
  "$schema": "https://json-schema.org/draft/2020-12/schema",
  "$defs": {
    "ForecastView": {
      "description": "Forecast display subset; extra producer fields are ignored (v4, A8).",
      "properties": {
        "months_to_full_enrollment": {
          "$ref": "#/$defs/MetricRange"
        },
        "milestone_dates": {
          "additionalProperties": {
            "$ref": "#/$defs/MetricRange"
          },
          "title": "Milestone Dates",
          "type": "object"
        },
        "enrollment_curve": {
          "items": {
            "maxItems": 4,
            "minItems": 4,
            "prefixItems": [
              {
                "type": "number"
              },
              {
                "type": "number"
              },
              {
                "type": "number"
              },
              {
                "type": "number"
              }
            ],
            "type": "array"
          },
          "title": "Enrollment Curve",
          "type": "array"
        },
        "draws_requested": {
          "anyOf": [
            {
              "minimum": 0,
              "type": "integer"
            },
            {
              "type": "null"
            }
          ],
          "default": null,
          "title": "Draws Requested"
        },
        "draws_used": {
          "anyOf": [
            {
              "minimum": 0,
              "type": "integer"
            },
            {
              "type": "null"
            }
          ],
          "default": null,
          "title": "Draws Used"
        },
        "curve_draws_used": {
          "anyOf": [
            {
              "minimum": 0,
              "type": "integer"
            },
            {
              "type": "null"
            }
          ],
          "default": null,
          "title": "Curve Draws Used"
        },
        "provenance": {
          "items": {
            "$ref": "#/$defs/ProvenanceItem"
          },
          "title": "Provenance",
          "type": "array"
        }
      },
      "required": [
        "months_to_full_enrollment"
      ],
      "title": "ForecastView",
      "type": "object"
    },
    "Levers": {
      "properties": {
        "enrollment_rate_multiplier": {
          "default": 1.0,
          "maximum": 1.5,
          "minimum": 0.5,
          "title": "Enrollment Rate Multiplier",
          "type": "number"
        },
        "added_country_count": {
          "default": 0,
          "maximum": 5,
          "minimum": 0,
          "title": "Added Country Count",
          "type": "integer"
        },
        "remote_monitoring_share": {
          "default": 0.0,
          "title": "Remote Monitoring Share",
          "type": "number"
        },
        "home_visit_numbers": {
          "default": [],
          "items": {
            "type": "integer"
          },
          "title": "Home Visit Numbers",
          "type": "array"
        },
        "remote_visit_numbers": {
          "default": [],
          "items": {
            "type": "integer"
          },
          "title": "Remote Visit Numbers",
          "type": "array"
        },
        "local_lab_share": {
          "default": 0.0,
          "title": "Local Lab Share",
          "type": "number"
        },
        "drug_supply_strategy": {
          "default": "upfront",
          "enum": [
            "upfront",
            "on_demand"
          ],
          "title": "Drug Supply Strategy",
          "type": "string"
        },
        "removed_procedures": {
          "default": [],
          "items": {
            "type": "string"
          },
          "title": "Removed Procedures",
          "type": "array"
        },
        "excluded_site_ids": {
          "default": [],
          "items": {
            "type": "string"
          },
          "title": "Excluded Site Ids",
          "type": "array"
        }
      },
      "title": "Levers",
      "type": "object"
    },
    "MetricRange": {
      "anyOf": [
        {
          "properties": {
            "p10": {
              "type": "number"
            },
            "p50": {
              "type": "number"
            },
            "p90": {
              "type": "number"
            }
          }
        },
        {
          "properties": {
            "p10": {
              "type": "null"
            },
            "p50": {
              "type": "null"
            },
            "p90": {
              "type": "null"
            }
          }
        }
      ],
      "description": "P10/P50/P90 of a metric. All three null = unknown (a required input is missing; \u00a72 rule 2: unknown \u2260 zero).",
      "properties": {
        "p10": {
          "anyOf": [
            {
              "type": "number"
            },
            {
              "type": "null"
            }
          ],
          "title": "P10"
        },
        "p50": {
          "anyOf": [
            {
              "type": "number"
            },
            {
              "type": "null"
            }
          ],
          "title": "P50"
        },
        "p90": {
          "anyOf": [
            {
              "type": "number"
            },
            {
              "type": "null"
            }
          ],
          "title": "P90"
        },
        "unit": {
          "enum": [
            "usd",
            "hours",
            "kg_co2e",
            "months",
            "patients",
            "percent",
            "kits",
            "count"
          ],
          "title": "Unit",
          "type": "string"
        }
      },
      "required": [
        "p10",
        "p50",
        "p90",
        "unit"
      ],
      "title": "MetricRange",
      "type": "object"
    },
    "ModuleBreakdown": {
      "properties": {
        "module": {
          "title": "Module",
          "type": "string"
        },
        "cost_usd": {
          "$ref": "#/$defs/MetricRange"
        },
        "co2e_kg": {
          "$ref": "#/$defs/MetricRange"
        },
        "provenance": {
          "items": {
            "$ref": "#/$defs/ProvenanceItem"
          },
          "title": "Provenance",
          "type": "array"
        }
      },
      "required": [
        "module",
        "cost_usd",
        "co2e_kg",
        "provenance"
      ],
      "title": "ModuleBreakdown",
      "type": "object"
    },
    "ProvenanceItem": {
      "properties": {
        "formula_id": {
          "title": "Formula Id",
          "type": "string"
        },
        "description": {
          "title": "Description",
          "type": "string"
        },
        "inputs": {
          "additionalProperties": {
            "anyOf": [
              {
                "type": "number"
              },
              {
                "type": "string"
              }
            ]
          },
          "title": "Inputs",
          "type": "object"
        },
        "parameter_ids": {
          "items": {
            "type": "string"
          },
          "title": "Parameter Ids",
          "type": "array"
        },
        "assumptions": {
          "default": [],
          "items": {
            "type": "string"
          },
          "title": "Assumptions",
          "type": "array"
        }
      },
      "required": [
        "formula_id",
        "description",
        "inputs",
        "parameter_ids"
      ],
      "title": "ProvenanceItem",
      "type": "object"
    },
    "SupplyView": {
      "description": "Supply display subset; extra producer fields are ignored (v4, A8).",
      "properties": {
        "kits_needed": {
          "$ref": "#/$defs/MetricRange"
        },
        "kits_produced": {
          "$ref": "#/$defs/MetricRange"
        },
        "kits_wasted": {
          "$ref": "#/$defs/MetricRange"
        },
        "waste_share": {
          "$ref": "#/$defs/MetricRange"
        },
        "shipments": {
          "$ref": "#/$defs/MetricRange"
        },
        "stockout_probability": {
          "maximum": 1,
          "minimum": 0,
          "title": "Stockout Probability",
          "type": "number"
        },
        "draws_requested": {
          "anyOf": [
            {
              "minimum": 0,
              "type": "integer"
            },
            {
              "type": "null"
            }
          ],
          "default": null,
          "title": "Draws Requested"
        },
        "draws_used": {
          "anyOf": [
            {
              "minimum": 0,
              "type": "integer"
            },
            {
              "type": "null"
            }
          ],
          "default": null,
          "title": "Draws Used"
        },
        "provenance": {
          "items": {
            "$ref": "#/$defs/ProvenanceItem"
          },
          "title": "Provenance",
          "type": "array"
        }
      },
      "required": [
        "kits_needed",
        "kits_produced",
        "kits_wasted",
        "waste_share",
        "shipments",
        "stockout_probability"
      ],
      "title": "SupplyView",
      "type": "object"
    }
  },
  "properties": {
    "design_id": {
      "title": "Design Id",
      "type": "string"
    },
    "levers": {
      "$ref": "#/$defs/Levers"
    },
    "cost_usd": {
      "$ref": "#/$defs/MetricRange"
    },
    "site_staff_hours": {
      "$ref": "#/$defs/MetricRange"
    },
    "patient_travel_hours": {
      "$ref": "#/$defs/MetricRange"
    },
    "co2e_kg": {
      "$ref": "#/$defs/MetricRange"
    },
    "duration_months": {
      "$ref": "#/$defs/MetricRange"
    },
    "drug_waste_share": {
      "$ref": "#/$defs/MetricRange"
    },
    "modules": {
      "items": {
        "$ref": "#/$defs/ModuleBreakdown"
      },
      "title": "Modules",
      "type": "array"
    },
    "warnings": {
      "default": [],
      "items": {
        "type": "string"
      },
      "title": "Warnings",
      "type": "array"
    },
    "parameter_set_version": {
      "title": "Parameter Set Version",
      "type": "string"
    },
    "computed_at": {
      "format": "date-time",
      "title": "Computed At",
      "type": "string"
    },
    "forecast": {
      "anyOf": [
        {
          "$ref": "#/$defs/ForecastView"
        },
        {
          "type": "null"
        }
      ],
      "default": null
    },
    "supply": {
      "anyOf": [
        {
          "$ref": "#/$defs/SupplyView"
        },
        {
          "type": "null"
        }
      ],
      "default": null
    }
  },
  "required": [
    "design_id",
    "levers",
    "cost_usd",
    "site_staff_hours",
    "patient_travel_hours",
    "co2e_kg",
    "duration_months",
    "drug_waste_share",
    "modules",
    "parameter_set_version",
    "computed_at"
  ],
  "title": "ScenarioResult",
  "type": "object"
}
