{"design_id": "7b0e2a52-4d4e-4a8e-9a39-1c1f3c5b9a10", "levers": {},
 "cost_usd": {"p10": 1, "p50": 2, "p90": 3, "unit": "usd"},
 "site_staff_hours": {"p10": 1, "p50": 2, "p90": 3, "unit": "hours"},
 "patient_travel_hours": {"p10": 1, "p50": 2, "p90": 3, "unit": "hours"},
 "co2e_kg": {"p10": 1, "p50": 2, "p90": 3, "unit": "kg_co2e"},
 "duration_months": {"p10": 1, "p50": 2, "p90": 3, "unit": "months"},
 "drug_waste_share": {"p10": 1, "p50": 2, "p90": 3, "unit": "percent"},
 "modules": [], "warnings": ["contract test fixture"], "parameter_set_version": "000000000000",
 "computed_at": "2026-10-16T21:00:00Z"}
